{
  "case_id": "HHG-013",
  "case": {
    "status": "closed_fraud",
    "verdict": "fraud",
    "fraud_probability": 0.99,
    "pattern": "out_of_region_use",
    "pattern_description": "",
    "affected_txn_ids": [
      "3526826"
    ],
    "first_suspicious_txn_id": "3526826",
    "connected_card_ids": [],
    "connected_device_profiles": [],
    "exposure_usd": 35.66,
    "evidence": [
      {
        "claim": "Transaction 3526826 amount is $35.66, channel is 'online', product is 'C', risk score is 0.76.",
        "source": "graph",
        "ref": "get_transaction_context",
        "entity_ids": [
          "3526826",
          "C07671-K2"
        ]
      },
      {
        "claim": "Transaction 3526826 is associated with card C07671-K2, customer C07671, billing region .",
        "source": "graph",
        "ref": "get_transaction_context",
        "entity_ids": [
          "C07671",
          "C07671-K2"
        ]
      },
      {
        "claim": "Card C07671-K2 history contains 1569 total transactions. Baseline amount mean=$112.42, stdev=$210.00.",
        "source": "graph",
        "ref": "get_card_history_summary",
        "entity_ids": [
          "3526826",
          "C07671-K2"
        ]
      },
      {
        "claim": "Flagged billing region  familiarity is 'novel_zero_history' (0 prior transactions in this region).",
        "source": "graph",
        "ref": "get_card_history_summary",
        "entity_ids": [
          "3526826",
          "C07671-K2"
        ]
      },
      {
        "claim": "Device profile links 0 unique cards across the network. Syndicate risk tier: LOW.",
        "source": "graph",
        "ref": "get_device_neighbors_summary",
        "entity_ids": [
          "3526826",
          "C07671-K2"
        ]
      },
      {
        "claim": "High score coupled with complete lack of geographic familiarity indicates out-of-region card compromise.",
        "source": "graph",
        "ref": "pattern_reasoner",
        "entity_ids": [
          "3526826",
          "C07671-K2"
        ]
      }
    ],
    "similar_prior_cases": [],
    "summary": "High-risk transaction ($35.66, score 0.76) conducted in completely novel region with zero prior history.",
    "written_to_graph": false,
    "graph_case_id": ""
  },
  "evidence_requests": [
    {
      "type": "customer_validation",
      "asked_after_step": 2,
      "assumed_response": "Cardholder confirmed fraudulent transaction."
    }
  ],
  "next_best_actions": {
    "initial": [
      {
        "action": "VERIFY_WITH_CUSTOMER",
        "route": "auto",
        "reason": "Rule R1: Verify with customer prior to blocking on single score signal."
      }
    ],
    "final": [
      {
        "action": "BLOCK_CARD",
        "route": "L1",
        "reason": "Recommended action BLOCK_CARD enforced by deterministic policy engine."
      },
      {
        "action": "CREATE_CASE",
        "route": "auto",
        "reason": "Recommended action CREATE_CASE enforced by deterministic policy engine."
      }
    ],
    "what_changed": "Customer verification response received (denied). Verdict transitioned to fraud, resulting in final action set: ['BLOCK_CARD', 'CREATE_CASE']."
  },
  "sar": {
    "file": false,
    "reason": "",
    "narrative": "",
    "subjects": [],
    "total_amount_usd": 0.0,
    "activity_dates": []
  },
  "stop_reason": "customer_denied",
  "tool_calls": 6,
  "tokens": 0,
  "latency_s": 7.364
}