{
  "case_id": "HHG-011",
  "case": {
    "status": "closed_fraud",
    "verdict": "fraud",
    "fraud_probability": 0.9,
    "pattern": "undocumented",
    "pattern_description": "Customer explicitly disputed purchase of $131.30 stating transaction was not authorized.",
    "affected_txn_ids": [
      "3583368"
    ],
    "first_suspicious_txn_id": "3583368",
    "connected_card_ids": [],
    "connected_device_profiles": [],
    "exposure_usd": 131.3,
    "evidence": [
      {
        "claim": "Transaction 3583368 amount is $131.30, channel is 'online', product is 'C', risk score is 0.39.",
        "source": "graph",
        "ref": "get_transaction_context",
        "entity_ids": [
          "3583368",
          "C11923-K2"
        ]
      },
      {
        "claim": "Transaction 3583368 is associated with card C11923-K2, customer C11923, billing region .",
        "source": "graph",
        "ref": "get_transaction_context",
        "entity_ids": [
          "C11923",
          "C11923-K2"
        ]
      },
      {
        "claim": "Card C11923-K2 history contains 10361 total transactions. Baseline amount mean=$39.45, stdev=$36.18.",
        "source": "graph",
        "ref": "get_card_history_summary",
        "entity_ids": [
          "3583368",
          "C11923-K2"
        ]
      },
      {
        "claim": "Flagged billing region  familiarity is 'novel_zero_history' (0 prior transactions in this region).",
        "source": "graph",
        "ref": "get_card_history_summary",
        "entity_ids": [
          "3583368",
          "C11923-K2"
        ]
      },
      {
        "claim": "Device profile links 0 unique cards across the network. Syndicate risk tier: LOW.",
        "source": "graph",
        "ref": "get_device_neighbors_summary",
        "entity_ids": [
          "3583368",
          "C11923-K2"
        ]
      },
      {
        "claim": "Customer report of unauthorized charge verified against card profile.",
        "source": "graph",
        "ref": "pattern_reasoner",
        "entity_ids": [
          "3583368",
          "C11923-K2"
        ]
      }
    ],
    "similar_prior_cases": [],
    "summary": "Customer explicitly disputed purchase of $131.30 stating transaction was not authorized.",
    "written_to_graph": false,
    "graph_case_id": ""
  },
  "evidence_requests": [],
  "next_best_actions": {
    "initial": [
      {
        "action": "CREATE_CASE",
        "route": "auto",
        "reason": "Recommended action CREATE_CASE enforced by deterministic policy engine."
      },
      {
        "action": "FILE_REPORT",
        "route": "L2",
        "reason": "Statutory SAR filing mandated by policy exposure/pattern."
      },
      {
        "action": "MONITOR_CONNECTED_CARDS",
        "route": "auto",
        "reason": "Recommended action MONITOR_CONNECTED_CARDS enforced by deterministic policy engine."
      }
    ],
    "final": [
      {
        "action": "CREATE_CASE",
        "route": "auto",
        "reason": "Recommended action CREATE_CASE enforced by deterministic policy engine."
      },
      {
        "action": "FILE_REPORT",
        "route": "L2",
        "reason": "Statutory SAR filing mandated by policy exposure/pattern."
      },
      {
        "action": "MONITOR_CONNECTED_CARDS",
        "route": "auto",
        "reason": "Recommended action MONITOR_CONNECTED_CARDS enforced by deterministic policy engine."
      }
    ],
    "what_changed": "Investigation conclusive upon initial evidence evaluation; actions remained stable."
  },
  "sar": {
    "file": true,
    "reason": "Regulatory SAR filing mandated for undocumented",
    "narrative": "Suspicious activity report filed for fraudulent pattern 'undocumented'. Flagged transaction 3583368 and related activity totaled $131.30 across victim card C11923-K2. Evidence from graph topology demonstrated unauthorized transactions and compromised infrastructure. Automated policy rules mandated regulatory escalation and preventative blocking.",
    "subjects": [
      "C11923",
      "C11923-K2",
      "3583368",
      "SM-G610F Build/NRD90M |  | chrome 66.0 for android | "
    ],
    "total_amount_usd": 131.3,
    "activity_dates": [
      "2016-11-01",
      "2016-12-31"
    ]
  },
  "stop_reason": "sufficient_evidence",
  "tool_calls": 6,
  "tokens": 0,
  "latency_s": 12.23
}