{
  "case_id": "HHG-009",
  "case": {
    "status": "closed_fraud",
    "verdict": "fraud",
    "fraud_probability": 0.99,
    "pattern": "undocumented",
    "pattern_description": "Customer denied the charge, a scenario not covered by predefined patterns; it falls under undocumented fraud.",
    "affected_txn_ids": [
      "3581141"
    ],
    "first_suspicious_txn_id": "3581141",
    "connected_card_ids": [],
    "connected_device_profiles": [
      " |  |  | "
    ],
    "exposure_usd": 30.02,
    "evidence": [
      {
        "claim": "Transaction 3581141 amount is $30.02, channel is 'online', product is 'S', risk score is 0.28.",
        "source": "graph",
        "ref": "get_transaction_context",
        "entity_ids": [
          "3581141",
          "C08299-K1"
        ]
      },
      {
        "claim": "Transaction 3581141 is associated with card C08299-K1, customer C08299, billing region 203.0.",
        "source": "graph",
        "ref": "get_transaction_context",
        "entity_ids": [
          "C08299",
          "C08299-K1"
        ]
      },
      {
        "claim": "Retrieved 0 historical closed cases referencing card C08299-K1.",
        "source": "graph",
        "ref": "get_similar_closed_cases",
        "entity_ids": [
          "3581141",
          "C08299-K1"
        ]
      },
      {
        "claim": "Card C08299-K1 history contains 56 total transactions. Baseline amount mean=$61.17, stdev=$62.28.",
        "source": "graph",
        "ref": "get_card_history_summary",
        "entity_ids": [
          "3581141",
          "C08299-K1"
        ]
      },
      {
        "claim": "Flagged billing region 203.0 familiarity is 'novel_zero_history' (0 prior transactions in this region).",
        "source": "graph",
        "ref": "get_card_history_summary",
        "entity_ids": [
          "3581141",
          "C08299-K1"
        ]
      },
      {
        "claim": "Device profile links 0 unique cards across the network. Syndicate risk tier: LOW.",
        "source": "graph",
        "ref": "get_device_neighbors_summary",
        "entity_ids": [
          "3581141",
          "C08299-K1"
        ]
      },
      {
        "claim": "Customer report of unauthorized charge verified against card profile.",
        "source": "graph",
        "ref": "pattern_reasoner",
        "entity_ids": [
          "3581141",
          "C08299-K1"
        ]
      },
      {
        "claim": "Policy R2 mandates blocking the card when a customer denies a transaction, regardless of exposure.",
        "source": "document",
        "ref": "llm:POLICY-R2",
        "entity_ids": [
          "3581141",
          "C08299-K1"
        ]
      },
      {
        "claim": "Card C08299-K1 has novel zero history in the billing region, indicating potential fraud risk.",
        "source": "graph",
        "ref": "llm:GRAPH-CARD-C08299-K1",
        "entity_ids": [
          "3581141",
          "C08299-K1"
        ]
      },
      {
        "claim": "Transaction amount $30.02 is below the $1,000 threshold, so no SAR is required per Policy R2.",
        "source": "document",
        "ref": "llm:POLICY-R2",
        "entity_ids": [
          "3581141",
          "C08299-K1"
        ]
      },
      {
        "claim": "Device network shows no shared device and low syndicate risk, reducing the likelihood of coordinated fraud.",
        "source": "graph",
        "ref": "llm:GRAPH-DEV- |  |  | ",
        "entity_ids": [
          "3581141",
          "C08299-K1"
        ]
      },
      {
        "claim": "Card testing detection rule R5 is not triggered because only one small transaction exists.",
        "source": "document",
        "ref": "llm:POLICY-R5",
        "entity_ids": [
          "3581141",
          "C08299-K1"
        ]
      },
      {
        "claim": "Transaction 3581141 is flagged with a moderate risk score of 0.28, suggesting some concern but not high severity.",
        "source": "graph",
        "ref": "llm:GRAPH-TXN-3581141",
        "entity_ids": [
          "3581141",
          "C08299-K1"
        ]
      }
    ],
    "similar_prior_cases": [],
    "summary": "Customer denied the charge, a scenario not covered by predefined patterns; it falls under undocumented fraud.",
    "written_to_graph": true,
    "graph_case_id": "HHG-009"
  },
  "evidence_requests": [
    {
      "type": "customer_validation",
      "asked_after_step": 2,
      "assumed_response": "Cardholder confirmed fraudulent transaction."
    }
  ],
  "next_best_actions": {
    "initial": [
      {
        "action": "VERIFY_WITH_CUSTOMER",
        "route": "auto",
        "reason": "Rule R1: Verify with customer prior to blocking on single score signal."
      }
    ],
    "final": [
      {
        "action": "BLOCK_CARD",
        "route": "L1",
        "reason": "Recommended action BLOCK_CARD enforced by deterministic policy engine."
      },
      {
        "action": "CREATE_CASE",
        "route": "auto",
        "reason": "Recommended action CREATE_CASE enforced by deterministic policy engine."
      }
    ],
    "what_changed": "Customer verification response received (denied). Verdict transitioned to fraud, resulting in final action set: ['BLOCK_CARD', 'CREATE_CASE']."
  },
  "sar": {
    "file": false,
    "reason": "",
    "narrative": "",
    "subjects": [],
    "total_amount_usd": 0.0,
    "activity_dates": []
  },
  "stop_reason": "customer_denied",
  "tool_calls": 6,
  "tokens": 818,
  "latency_s": 21.549
}